Event Index,UTC Timestamp,UTC Date and Time,Local Timestamp,Local Timezone,Local Date and Time,Experiment ID,Experiment Version,Tree Node Key,Repeat Key,Schedule ID,Participant Public ID,Participant Private ID,Participant Starting Group,Participant Status,Participant Completion Code,Participant External Session ID,Participant Device Type,Participant Device,Participant OS,Participant Browser,Participant Monitor Size,Participant Viewport Size,Checkpoint,Task Name,Task Version,randomiser-j7g2,cause_A Value,heard_A Response,heard_A Quantised,prev_A Response,prev_A Quantised,Q1_A Response,Q1_A Quantised,Q2_A Response,Q2_A Quantised,Q3_A Response,Q3_A Quantised,Q4_A Response,Q4_A Quantised,Q5_A Response,Q5_A Quantised,Q6_A Response,Q6_A Quantised
,,,,,,,,,,,,,,,,,,,,,,,,,,,"1&#46; What do you think the procedure is supposed to cause (what is the participant expected to experience)? 
Please answer this question briefly (in not more than two sentences).",2&#46; Have you heard of this procedure before?,2&#46; Have you heard of this procedure before?,3&#46; Have you previously participated in an experiment in which this procedure was used?,3&#46; Have you previously participated in an experiment in which this procedure was used?,"**At some point, it felt as if my real body was starting to take on the posture or shape of the virtual body that I saw.**","**At some point, it felt as if my real body was starting to take on the posture or shape of the virtual body that I saw.**",**I felt as if the virtual body was my body.**,**I felt as if the virtual body was my body.**,"**At some point, it felt that the virtual body resembled my own (real) body, in terms of shape, skin tone or other visual features.**","**At some point, it felt that the virtual body resembled my own (real) body, in terms of shape, skin tone or other visual features.**",**I felt as if my body was located where I saw the virtual body.**,**I felt as if my body was located where I saw the virtual body.**,**I felt like I could control the virtual body as if it was my own body.**,**I felt like I could control the virtual body as if it was my own body.**,**It seemed as if I felt the touch of the floor in the location where I saw the virtual body touched.**,**It seemed as if I felt the touch of the floor in the location where I saw the virtual body touched.**
1,1689936607381,21/07/2023 10:50:07,1689940207381,1,21/07/2023 12:50:07,139320,6,questionnaire-ihw3,,30792339,BLIND,9143401,,complete,,64ba6f9cef2670e70994468b,computer,Desktop or Laptop,Mac OS 10.15.7,Chrome 114.0.0.0,1280x800,1273x697,,asynchronous,6,synchronous first,For the participant to become familiar with how the virtual body moved and how to control it.,No,2,No,2,-2,2,-3,1,-3,1,-3,1,-3,1,-3,1
1,1689936664608,21/07/2023 10:51:04,1689940264608,1,21/07/2023 12:51:04,139320,6,questionnaire-ihw3,,30792368,BLIND,9143409,,complete,,64ba7026b173d4a486a2a408,mobile,Apple iPhone,iOS 16.1.1,Mobile Safari 16.1,375x812,375x629,,asynchronous,6,synchronous first,an experience of the avatar conducting movements seperatly from inout given by the subject. Maybe making them feel an experience they have no control over,No,2,No,2,1,5,0,4,2,6,0,4,-3,1,-2,2
END OF FILE
